{
    "navbar": {
      "logo": {
        "src": "/images/docu.svg",
        "alt": "DocuBook Logo"
      },
      "logoText": "DocuBook",
      "menu": [
        { "title": "Docs", "href": "/docs/getting-started/introduction" },
        { "title": "Showcase", "href": "/showcase" },
        { "title": "Blog", "href": "/blog" },
        { "title": "Changelog", "href": "/changelog" }
      ]
    },
    "footer": {
      "copyright": "DocuBook",
      "social": [
        {
            "name": "Instagram",
            "url": "https://www.instagram.com/wildan.nrs/",
            "iconName": "InstagramIcon"
        },
        {
            "name": "Facebook",
            "url": "https://www.facebook.com/wildan.nrsh",
            "iconName": "FacebookIcon"
        },
        {
            "name": "Twitter",
            "url": "https://x.com/wildan_nrss",
            "iconName": "TwitterIcon"
        },
        {
            "name": "Youtube",
            "url": "https://www.youtube.com/@wildan.nrs_",
            "iconName": "YoutubeIcon"
        }
      ]
    },
    "meta": {
      "baseURL": "https://docubook.pro",
      "title": "DocuBook",
      "description": "DocuBook is a modern documentation platform for building, deploying, and managing your docs with ease.",
      "favicon": "/favicon.ico"
    },
    "repository": {
      "url": "https://github.com/gitfromwildan/docubook",
      "editPathTemplate": "/blob/main/{filePath}",
      "editLink": true
    },
    "routes": [
    {
      "title": "Getting Started",
      "href": "/getting-started",
      "noLink": true,
      "items": [
        { "title": "Introduction", "href": "/introduction" },
        { "title": "Installation", "href": "/installation" },
        { "title": "Quick Start Guide", "href": "/quick-start-guide" },
        { "title": "Project Structure", "href": "/project-structure" },
        {
          "title": "Components",
          "href": "/components",
          "items": [
            { "title": "Stepper", "href": "/stepper" },
            { "title": "Tabs", "href": "/tabs" },
            { "title": "Note", "href": "/note" },
            { "title": "Code Block", "href": "/code-block" },
            { "title": "Image", "href": "/image" },
            { "title": "Link", "href": "/link" },
            { "title": "Youtube", "href": "/youtube" },
            { "title": "Tooltips", "href": "/tooltips" },
            { "title": "Cards", "href": "/card" },
            { "title": "Card Group", "href": "/card-group" },
            { "title": "Button", "href": "/button" },
            { "title": "Accordion", "href": "/accordion" },
            { "title": "Release Note", "href": "/release-note" },
            { "title": "Custom", "href": "/custom" }
          ]
        },
        { "title": "Customize", "href": "/customize" }
      ]
    }
  ]
}
